<?xml version="1.0" encoding="UTF-8"?>
<houseHold xmlns:xsi="http://www.w3.org/2001/XMLSchema-instance" xsi:noNamespaceSchemaLocation="HouseHoldSchema-v2.xsd">
  <healthInsuranceInfo>
    <hasHealthCoverage>hasHealthCoverage</hasHealthCoverage>
    <insuranceFromJobs>
      <coverageDate>2001-12-31T12:00:00</coverageDate>
      <employeeName>employeeName</employeeName>
      <employeeSSN>employeeSSN</employeeSSN>
      <employerAddress>
        <apartment>apartment</apartment>
        <city>city</city>
        <state>state</state>
        <street>street</street>
        <zip>zip</zip>
      </employerAddress>
      <employerEIN>employerEIN</employerEIN>
      <employerName>employerName</employerName>
      <employerPhone>employerPhone</employerPhone>
      <familyMembersCovered>familyMembersCovered</familyMembersCovered>
      <isCoveredNext3Months>isCoveredNext3Months</isCoveredNext3Months>
      <isCoveredNextYear>isCoveredNextYear</isCoveredNextYear>
      <isEligible>isEligible</isEligible>
      <jobInsuranceContact>
        <email>email</email>
        <name>name</name>
        <phone>phone</phone>
      </jobInsuranceContact>
      <lowCostPremium>lowCostPremium</lowCostPremium>
      <meetsMinimumStandards>meetsMinimumStandards</meetsMinimumStandards>
      <newYearPlanChanges>
        <minCoverageDateChange>2001-12-31T12:00:00</minCoverageDateChange>
        <minCoverageOffered>minCoverageOffered</minCoverageOffered>
        <minCoveragePremium>minCoveragePremium</minCoveragePremium>
        <minPremiumFrequency>minPremiumFrequency</minPremiumFrequency>
        <noCoverageOffered>noCoverageOffered</noCoverageOffered>
      </newYearPlanChanges>
      <peopleCovered>
        <coverageDropDate>2001-12-31T12:00:00</coverageDropDate>
        <eligibilityStartDate>2001-12-31T12:00:00</eligibilityStartDate>
        <enrollmentStartDate>2001-12-31T12:00:00</enrollmentStartDate>
        <enrollmentStatus>enrollmentStatus</enrollmentStatus>
        <firstName>firstName</firstName>
        <futureChanges>futureChanges</futureChanges>
        <lastName>lastName</lastName>
        <middleName>middleName</middleName>
      </peopleCovered>
      <premiumFrequency>premiumFrequency</premiumFrequency>
    </insuranceFromJobs>
    <otherInsurance>
      <hasOtherInsurance>hasOtherInsurance</hasOtherInsurance>
      <otherInsuranceDetails>
        <insuranceType>insuranceType</insuranceType>
        <name>name</name>
        <planName>planName</planName>
        <policyNumber>policyNumber</policyNumber>
      </otherInsuranceDetails>
    </otherInsurance>
  </healthInsuranceInfo>
  <houseHoldInfo>
    <contactInfo>
      <birthDate>2001-12-31T12:00:00</birthDate>
      <emailAddress>emailAddress</emailAddress>
      <firstName>firstName</firstName>
      <gender>gender</gender>
      <householdAddress>
        <apartment>apartment</apartment>
        <city>city</city>
        <state>state</state>
        <street>street</street>
        <zip>zip</zip>
      </householdAddress>
      <isEmailNeeded>isEmailNeeded</isEmailNeeded>
      <isEnglishPreferred>isEnglishPreferred</isEnglishPreferred>
      <isInterpreterNeeded>isInterpreterNeeded</isInterpreterNeeded>
      <isMailingAddress>isMailingAddress</isMailingAddress>
      <lastName>lastName</lastName>
      <mailingAddress>
        <apartment>apartment</apartment>
        <city>city</city>
        <state>state</state>
        <street>street</street>
        <zip>zip</zip>
      </mailingAddress>
      <middleName>middleName</middleName>
      <otherLanguage>otherLanguage</otherLanguage>
      <primaryExtension>primaryExtension</primaryExtension>
      <primaryPhone>primaryPhone</primaryPhone>
      <secondaryExtension>secondaryExtension</secondaryExtension>
      <secondaryPhone>secondaryPhone</secondaryPhone>
      <spanishOrOther>spanishOrOther</spanishOrOther>
      <suffix>suffix</suffix>
    </contactInfo>
    <houseHoldMembers>houseHoldMembers</houseHoldMembers>
    <members>
      <deductions>
        <deductionItems>
          <amount>amount</amount>
          <frequency>frequency</frequency>
          <type>type</type>
        </deductionItems>
        <haveDeductions>haveDeductions</haveDeductions>
      </deductions>
      <generalInfo>
        <age>0</age>
        <birthDate>2001-12-31T12:00:00</birthDate>
        <firstName>firstName</firstName>
        <gender>gender</gender>
        <isPregnant>isPregnant</isPregnant>
        <lastName>lastName</lastName>
        <livesWithSpouse>livesWithSpouse</livesWithSpouse>
        <maritalStatus>maritalStatus</maritalStatus>
        <middleName>middleName</middleName>
        <numberOfBabies>numberOfBabies</numberOfBabies>
        <pregnancyDueDate>2001-12-31T12:00:00</pregnancyDueDate>
        <relationship>relationship</relationship>
        <ssn>ssn</ssn>
        <suffix>suffix</suffix>
      </generalInfo>
      <incomeInfo>
        <incomeItems>
          <employerAddress>
            <apartment>apartment</apartment>
            <city>city</city>
            <state>state</state>
            <street>street</street>
            <zip>zip</zip>
          </employerAddress>
          <employerName>employerName</employerName>
          <employerPhone>employerPhone</employerPhone>
          <isSelfEmployed>isSelfEmployed</isSelfEmployed>
          <monthlyNetIncome>monthlyNetIncome</monthlyNetIncome>
          <payFrequency>payFrequency</payFrequency>
          <typeOfWork>typeOfWork</typeOfWork>
          <wagesPerPayPeriod>wagesPerPayPeriod</wagesPerPayPeriod>
          <weekHoursWorked>weekHoursWorked</weekHoursWorked>
        </incomeItems>
        <isEmployed>isEmployed</isEmployed>
        <pastThreeMonths>pastThreeMonths</pastThreeMonths>
      </incomeInfo>
      <isCaseHOH>isCaseHOH</isCaseHOH>
      <otherAssistance>
        <ageWhenLeft>ageWhenLeft</ageWhenLeft>
        <applyingForOther>applyingForOther</applyingForOther>
        <beenInFosterCare>beenInFosterCare</beenInFosterCare>
        <billMonths>billMonths</billMonths>
        <childCare>childCare</childCare>
        <hasEligibleImmigration>hasEligibleImmigration</hasEligibleImmigration>
        <hasPastMedicalBills>hasPastMedicalBills</hasPastMedicalBills>
        <hasPublicEmployeeCoverage>hasPublicEmployeeCoverage</hasPublicEmployeeCoverage>
        <hasSSI>hasSSI</hasSSI>
        <immigrationIdNumber>immigrationIdNumber</immigrationIdNumber>
        <immigrationType>immigrationType</immigrationType>
        <isDisabledBlind>isDisabledBlind</isDisabledBlind>
        <isNative>isNative</isNative>
        <isPrimaryCareTaker>isPrimaryCareTaker</isPrimaryCareTaker>
        <isStudent>isStudent</isStudent>
        <isUSCitizen>isUSCitizen</isUSCitizen>
        <isVeteran>isVeteran</isVeteran>
        <livedSince1996>livedSince1996</livedSince1996>
        <needsDailyAssistance>needsDailyAssistance</needsDailyAssistance>
        <receivedHealthcare>receivedHealthcare</receivedHealthcare>
        <ssn>ssn</ssn>
        <stateFosterCare>stateFosterCare</stateFosterCare>
        <tribe>tribe</tribe>
      </otherAssistance>
      <otherIncome>
        <expectedIncomeNextYear>expectedIncomeNextYear</expectedIncomeNextYear>
        <expectedIncomeThisYear>expectedIncomeThisYear</expectedIncomeThisYear>
        <isIncomeSteady>isIncomeSteady</isIncomeSteady>
        <incomeItems>
          <amount>amount</amount>
          <frequency>frequency</frequency>
          <isTribal>isTribal</isTribal>
          <otherIncomeType>otherIncomeType</otherIncomeType>
        </incomeItems>
        <otherIncomeReceived>otherIncomeReceived</otherIncomeReceived>
      </otherIncome>
      <raceEthnicity>
        <hispanicCategory>hispanicCategory</hispanicCategory>
        <hispanicCategoryOther>hispanicCategoryOther</hispanicCategoryOther>
        <isHispanicLatino>isHispanicLatino</isHispanicLatino>
        <race>race</race>
        <raceOther>raceOther</raceOther>
      </raceEthnicity>
      <taxInfo>
        <claimedOnOther>
          <otherFilerName>otherFilerName</otherFilerName>
          <relationToFiler>relationToFiler</relationToFiler>
        </claimedOnOther>
        <dependents>dependents</dependents>
        <filingFederalTax>filingFederalTax</filingFederalTax>
        <filingJoint>filingJoint</filingJoint>
        <isClaimedOnOther>isClaimedOnOther</isClaimedOnOther>
        <isClaimingDependents>isClaimingDependents</isClaimingDependents>
        <spouseName>spouseName</spouseName>
      </taxInfo>
      <yearlyIncome>
        <currentAnnualIncome>currentAnnualIncome</currentAnnualIncome>
        <nextAnnualIncome>nextAnnualIncome</nextAnnualIncome>
      </yearlyIncome>
    </members>
  </houseHoldInfo>
  <otherInfo>
    <agreeCSECoop>agreeCSECoop</agreeCSECoop>
    <agreeInfoRelease>agreeInfoRelease</agreeInfoRelease>
    <agreeMedEstate>agreeMedEstate</agreeMedEstate>
    <agreePrivacy>agreePrivacy</agreePrivacy>
    <agreeReadSign>agreeReadSign</agreeReadSign>
    <agreeResp>agreeResp</agreeResp>
    <agreeReviews>agreeReviews</agreeReviews>
    <agreeRights>agreeRights</agreeRights>
    <agreeThirdParty>agreeThirdParty</agreeThirdParty>
    <applicantIncarcerated>applicantIncarcerated</applicantIncarcerated>
    <authorizedRepresentatives>
      <doYouAgree>doYouAgree</doYouAgree>
      <repAddress>
        <apartment>apartment</apartment>
        <city>city</city>
        <state>state</state>
        <street>street</street>
        <zip>zip</zip>
      </repAddress>
      <repName>repName</repName>
      <repPhone>repPhone</repPhone>
    </authorizedRepresentatives>
    <coverageRenewalAPTC>
      <allowReturnAccess>allowReturnAccess</allowReturnAccess>
      <numberOfYears>numberOfYears</numberOfYears>
    </coverageRenewalAPTC>
    <incarcerations>
      <dispositionPending>dispositionPending</dispositionPending>
      <personName>personName</personName>
    </incarcerations>